"","SVM_LABEL","SVM_PROB","GLMNET_LABEL","GLMNET_PROB","MAXENTROPY_LABEL","MAXENTROPY_PROB","SLDA_LABEL","SLDA_PROB","LOGITBOOST_LABEL","LOGITBOOST_PROB","BAGGING_LABEL","BAGGING_PROB","FORESTS_LABEL","FORESTS_PROB","NNETWORK_LABEL","NNETWORK_PROB","TREE_LABEL","TREE_PROB","sentence"
"1","-1",0.627663714110513,"-1",0.620608420943009,"5",0.471306484782602,"-1",0.625494541604655,"-1",0.5,"-1",1,"-1",0.67,"-1",0.538351578610626,"-1",0.62573385518591,"charles """"chuck"""" ash."
"2","-1",0.629445501318622,"-1",0.620608420943009,"5",0.525663752076944,"-1",0.607758350525898,"-1",0.5,"-1",0.96,"-1",0.625,"-1",0.477649543115685,"-1",0.62573385518591,"charles """"chu| charles """"chuck"""" ash."
"3","-1",0.638201275446076,"-1",0.568718117574832,"-1",0.668987498183907,"-1",0.562360002175433,"-1",0.5,"-1",0.92,"-1",0.765,"-1",0.676868801507765,"-1",0.62573385518591,"charles """"chuck"""" ash, 64, passed away june 9, 2015. he was born in spencer, w. va. on march 18, 1951 and attended the victory chapel."
"4","-1",0.633377287194539,"-1",0.703449966792826,"-1",0.767119725345069,"-1",0.721761509185838,"-1",0.5,"-1",1,"-1",0.945,"-1",0.676868801507765,"-1",0.62573385518591,"chuck was preceded in death by his parents, willie and jo ash; brother, paul; daughter-in-law naomi; and special aunt, thelma."
"5","-1",0.632849563775893,"-1",0.764977610607579,"-1",0.855480624495296,"-1",0.809018794924436,"-1",0.880797077977882,"-1",0.72,"-1",0.835,"-1",0.676868801507765,"-1",0.62573385518591,"he is survived by loving wife of 42 years, sheila; children allen, augusta (jeremy) chambers, and crystal (jay) miller; grandchildren, bradley, jaylen, ashley, caitlin, ethan, landon and jaxon; brothers, larry, robert and james; and numerous extended family and friends."
"6","1",0.935238123823037,"1",0.604489679473419,"1",0.997024768890269,"1",0.966440924820539,"1",0.880797077977882,"5",0.72,"1",0.75,"1",0.721295352030083,"1",0.464406779661017,"funeral service will be held at 11 a. m. on saturday, june 13, 2015 at cox funeral home, 222 norton ave. in barberton, with pastor bobby webb officiating."
"7","-1",0.650149322669675,"-1",0.612114638443469,"-1",0.508689241305078,"-1",0.654879722174828,"-1",0.5,"-1",1,"-1",0.64,"1",0.70928793858331,"-1",0.62573385518591,"burial at lakewood cemetery."
"8","5",0.41582625836256,"-1",0.478269086072899,"1",0.803727204169293,"-1",0.602283364148555,"5",0.5,"-1",0.68,"-1",0.47,"1",0.721295352030083,"1",0.464406779661017,"family will receive friends friday from 6 to 8 p. m. cox, barberton 330-745-3311 published in akron beacon journal on june 11, 2015"
