"get order flowers now for dorothy's visitation service. jun 15. 1:00 pm logan chapel a. m. e. zion9505 parkton road. charlotte, nc, usget order flowers now for dorothy's service wall 365 days of grief support. subscribe facebook linkedin a. e. grier & sons funeral ceremony of choice website designed by funeralone contact obituaries about store 
mrs. dorothy lee spears-benton| home obituaries flowers & gifts grief & healing plan ahead resources about contact a. e. grier & sons funeral ceremony of choice 
", "4"
"get order flowers now for dorothy's visitation service. jun 15. 1:00 pm logan chapel a. m. e. zion9505 parkton road. charlotte, nc, usget order flowers now for dorothy's service wall 365 days of grief support. subscribe facebook linkedin a. e. grier & sons funeral ceremony of choice website designed by funeralone contact obituaries about store 
mrs. dorothy lee spears-benton| home obituaries flowers & gifts grief & healing plan ahead resources about contact a. e. grier & sons funeral ceremony of choice 
", "4"
